{"destination":{"product":"postgresql"},"direction":"graph-to-relational","identityAlgorithm":"rtg-id/v1","identityProperty":"rtg_id","lossPolicy":"strict","mapping":{"hash":"ba49dc1f2ef0240f0b2d095746c8bc354c91b45a99566fe979ba9fdbae9c8d56","name":"ecommerce-reverse"},"source":{"product":"neo4j"},"specVersion":"1.0.0","steps":[{"dependsOn":[],"id":"table:public.customers","kind":"ensure-table","sql":"CREATE TABLE IF NOT EXISTS \"public\".\"customers\" (\n    \"id\" bigint NOT NULL,\n    \"email\" text,\n    \"full_name\" text,\n    \"created_at\" timestamp(6) with time zone,\n    \"referred_by\" bigint,\n    PRIMARY KEY (\"id\"),\n    FOREIGN KEY (\"referred_by\") REFERENCES \"public\".\"customers\" (\"id\")\n)","table":{"name":"customers","schema":"public"}},{"dependsOn":[],"id":"table:public.products","kind":"ensure-table","sql":"CREATE TABLE IF NOT EXISTS \"public\".\"products\" (\n    \"id\" bigint NOT NULL,\n    \"sku\" text,\n    \"name\" text,\n    \"price\" numeric,\n    \"parent_product_id\" bigint,\n    PRIMARY KEY (\"id\"),\n    FOREIGN KEY (\"parent_product_id\") REFERENCES \"public\".\"products\" (\"id\")\n)","table":{"name":"products","schema":"public"}},{"dependsOn":[],"id":"table:public.orders","kind":"ensure-table","sql":"CREATE TABLE IF NOT EXISTS \"public\".\"orders\" (\n    \"id\" bigint NOT NULL,\n    \"status\" text,\n    \"placed_at\" timestamp(6) with time zone,\n    \"customer_id\" bigint,\n    PRIMARY KEY (\"id\"),\n    FOREIGN KEY (\"customer_id\") REFERENCES \"public\".\"customers\" (\"id\")\n)","table":{"name":"orders","schema":"public"}},{"dependsOn":[],"id":"table:public.order_items","kind":"ensure-table","sql":"CREATE TABLE IF NOT EXISTS \"public\".\"order_items\" (\n    \"order_id\" bigint NOT NULL,\n    \"line_no\" bigint NOT NULL,\n    \"quantity\" bigint,\n    \"unit_price\" numeric,\n    \"product_id\" bigint,\n    PRIMARY KEY (\"order_id\", \"line_no\"),\n    FOREIGN KEY (\"order_id\") REFERENCES \"public\".\"orders\" (\"id\"),\n    FOREIGN KEY (\"product_id\") REFERENCES \"public\".\"products\" (\"id\")\n)","table":{"name":"order_items","schema":"public"}},{"dependsOn":["table:public.customers"],"entity":"Customer","id":"rows:Customer","key":[{"column":"id","nativeType":"bigint","nullable":false,"property":"id","type":"int64"}],"kind":"load-rows","labels":["Customer"],"properties":[{"column":"id","nativeType":"bigint","nullable":false,"property":"id","type":"int64"},{"column":"email","nativeType":"text","nullable":true,"property":"email","type":"string"},{"column":"full_name","nativeType":"text","nullable":true,"property":"fullName","type":"string"},{"column":"created_at","fractionalDigits":6,"nativeType":"timestamp(6) with time zone","nullable":true,"property":"createdAt","type":"timestamptz"}],"table":{"name":"customers","schema":"public"}},{"dependsOn":["table:public.products"],"entity":"Product","id":"rows:Product","key":[{"column":"id","nativeType":"bigint","nullable":false,"property":"id","type":"int64"}],"kind":"load-rows","labels":["Product"],"properties":[{"column":"id","nativeType":"bigint","nullable":false,"property":"id","type":"int64"},{"column":"sku","nativeType":"text","nullable":true,"property":"sku","type":"string"},{"column":"name","nativeType":"text","nullable":true,"property":"name","type":"string"},{"column":"price","nativeType":"numeric","nullable":true,"property":"price","type":"decimal"}],"table":{"name":"products","schema":"public"}},{"dependsOn":["table:public.orders","rows:Customer"],"entity":"Order","foreignKeys":[{"columns":[{"column":"customer_id","nativeType":"bigint","nullable":true,"type":"int64"}],"deferred":false,"direction":"incoming","referencedKey":[{"column":"id","nativeType":"bigint","nullable":false,"property":"id","type":"int64"}],"referencedLabels":["Customer"],"references":"Customer","relationship":"CustomerPlacedOrder","relationshipType":"PLACED"}],"id":"rows:Order","key":[{"column":"id","nativeType":"bigint","nullable":false,"property":"id","type":"int64"}],"kind":"load-rows","labels":["Order"],"properties":[{"column":"id","nativeType":"bigint","nullable":false,"property":"id","type":"int64"},{"column":"status","nativeType":"text","nullable":true,"property":"status","type":"string"},{"column":"placed_at","fractionalDigits":6,"nativeType":"timestamp(6) with time zone","nullable":true,"property":"placedAt","type":"timestamptz"}],"table":{"name":"orders","schema":"public"}},{"dependsOn":["table:public.order_items","rows:Order","rows:Product"],"entity":"OrderItem","foreignKeys":[{"columns":[{"column":"order_id","nativeType":"bigint","nullable":true,"type":"int64"}],"deferred":false,"direction":"incoming","referencedKey":[{"column":"id","nativeType":"bigint","nullable":false,"property":"id","type":"int64"}],"referencedLabels":["Order"],"references":"Order","relationship":"OrderContainsItem","relationshipType":"CONTAINS"},{"columns":[{"column":"product_id","nativeType":"bigint","nullable":true,"type":"int64"}],"deferred":false,"direction":"outgoing","referencedKey":[{"column":"id","nativeType":"bigint","nullable":false,"property":"id","type":"int64"}],"referencedLabels":["Product"],"references":"Product","relationship":"ItemOfProduct","relationshipType":"OF_PRODUCT"}],"id":"rows:OrderItem","key":[{"column":"order_id","nativeType":"bigint","nullable":false,"property":"orderId","type":"int64"},{"column":"line_no","nativeType":"bigint","nullable":false,"property":"lineNo","type":"int64"}],"kind":"load-rows","labels":["OrderItem"],"properties":[{"column":"order_id","nativeType":"bigint","nullable":false,"property":"orderId","type":"int64"},{"column":"line_no","nativeType":"bigint","nullable":false,"property":"lineNo","type":"int64"},{"column":"quantity","nativeType":"bigint","nullable":true,"property":"quantity","type":"int64"},{"column":"unit_price","nativeType":"numeric","nullable":true,"property":"unitPrice","type":"decimal"}],"table":{"name":"order_items","schema":"public"}},{"dependsOn":["rows:Customer"],"entity":"Customer","foreignKeys":[{"columns":[{"column":"referred_by","nativeType":"bigint","nullable":true,"type":"int64"}],"deferred":true,"direction":"outgoing","referencedKey":[{"column":"id","nativeType":"bigint","nullable":false,"property":"id","type":"int64"}],"referencedLabels":["Customer"],"references":"Customer","relationship":"CustomerReferredBy","relationshipType":"REFERRED_BY"}],"id":"foreign-keys:CustomerReferredBy","key":[{"column":"id","nativeType":"bigint","nullable":false,"property":"id","type":"int64"}],"kind":"update-foreign-keys","labels":["Customer"],"table":{"name":"customers","schema":"public"}},{"dependsOn":["rows:Product"],"entity":"Product","foreignKeys":[{"columns":[{"column":"parent_product_id","nativeType":"bigint","nullable":true,"type":"int64"}],"deferred":true,"direction":"outgoing","referencedKey":[{"column":"id","nativeType":"bigint","nullable":false,"property":"id","type":"int64"}],"referencedLabels":["Product"],"references":"Product","relationship":"ProductVariantOf","relationshipType":"VARIANT_OF"}],"id":"foreign-keys:ProductVariantOf","key":[{"column":"id","nativeType":"bigint","nullable":false,"property":"id","type":"int64"}],"kind":"update-foreign-keys","labels":["Product"],"table":{"name":"products","schema":"public"}}],"transformations":[],"warnings":[{"code":"RTG-PLAN-011","message":"no range index on :Customer(id); every batch read sorts the label, which is slow for large labels. Create one: CREATE INDEX FOR (n:`Customer`) ON (n.`id`)","path":"/entities/0/key"},{"code":"RTG-PLAN-011","message":"no range index on :Product(id); every batch read sorts the label, which is slow for large labels. Create one: CREATE INDEX FOR (n:`Product`) ON (n.`id`)","path":"/entities/1/key"},{"code":"RTG-PLAN-011","message":"no range index on :Order(id); every batch read sorts the label, which is slow for large labels. Create one: CREATE INDEX FOR (n:`Order`) ON (n.`id`)","path":"/entities/2/key"},{"code":"RTG-PLAN-011","message":"no range index on :OrderItem(orderId, lineNo); every batch read sorts the label, which is slow for large labels. Create one: CREATE INDEX FOR (n:`OrderItem`) ON (n.`orderId`, n.`lineNo`)","path":"/entities/3/key"}]}
