{"destination":{"product":"neo4j"},"direction":"relational-to-graph","identityAlgorithm":"rtg-id/v1","identityProperty":"rtg_id","lossPolicy":"strict","mapping":{"hash":"e05d27fa0b25182f462e92e190201c5806953e19f2cfbf6bfcf88d5bfa190a4f","name":"ecommerce"},"source":{"product":"postgresql"},"specVersion":"0.1.0","steps":[{"dependsOn":[],"id":"constraint:Customer","kind":"ensure-identity-constraint","label":"Customer","property":"rtg_id"},{"dependsOn":[],"id":"constraint:Product","kind":"ensure-identity-constraint","label":"Product","property":"rtg_id"},{"dependsOn":[],"id":"constraint:Order","kind":"ensure-identity-constraint","label":"Order","property":"rtg_id"},{"dependsOn":[],"id":"constraint:OrderItem","kind":"ensure-identity-constraint","label":"OrderItem","property":"rtg_id"},{"dependsOn":["constraint:Customer"],"entity":"Customer","id":"nodes:Customer","key":[{"column":"id","nativeType":"bigint","nullable":false,"property":"id","type":"int64"}],"kind":"load-nodes","labels":["Customer"],"properties":[{"column":"id","nativeType":"bigint","nullable":false,"property":"id","type":"int64"},{"column":"email","nativeType":"text","nullable":false,"property":"email","type":"string"},{"column":"full_name","nativeType":"text","nullable":false,"property":"fullName","type":"string"},{"column":"created_at","nativeType":"timestamp with time zone","nullable":false,"property":"createdAt","type":"timestamptz"}],"table":{"name":"customers","schema":"public"}},{"dependsOn":["constraint:Product"],"entity":"Product","id":"nodes:Product","key":[{"column":"id","nativeType":"bigint","nullable":false,"property":"id","type":"int64"}],"kind":"load-nodes","labels":["Product"],"properties":[{"column":"id","nativeType":"bigint","nullable":false,"property":"id","type":"int64"},{"column":"sku","nativeType":"text","nullable":false,"property":"sku","type":"string"},{"column":"name","nativeType":"text","nullable":false,"property":"name","type":"string"},{"column":"price","nativeType":"numeric(12,2)","nullable":false,"property":"price","type":"decimal"}],"table":{"name":"products","schema":"public"}},{"dependsOn":["constraint:Order"],"entity":"Order","id":"nodes:Order","key":[{"column":"id","nativeType":"bigint","nullable":false,"property":"id","type":"int64"}],"kind":"load-nodes","labels":["Order"],"properties":[{"column":"id","nativeType":"bigint","nullable":false,"property":"id","type":"int64"},{"column":"status","nativeType":"text","nullable":false,"property":"status","type":"string"},{"column":"placed_at","nativeType":"timestamp with time zone","nullable":false,"property":"placedAt","type":"timestamptz"}],"table":{"name":"orders","schema":"public"}},{"dependsOn":["constraint:OrderItem"],"entity":"OrderItem","id":"nodes:OrderItem","key":[{"column":"order_id","nativeType":"bigint","nullable":false,"property":"orderId","type":"int64"},{"column":"line_no","nativeType":"integer","nullable":false,"property":"lineNo","type":"int64"}],"kind":"load-nodes","labels":["OrderItem"],"properties":[{"column":"order_id","nativeType":"bigint","nullable":false,"property":"orderId","type":"int64"},{"column":"line_no","nativeType":"integer","nullable":false,"property":"lineNo","type":"int64"},{"column":"quantity","nativeType":"integer","nullable":false,"property":"quantity","type":"int64"},{"column":"unit_price","nativeType":"numeric(12,2)","nullable":false,"property":"unitPrice","type":"decimal"}],"table":{"name":"order_items","schema":"public"}},{"dependsOn":["nodes:Customer","nodes:Order"],"entity":"Order","foreignKey":{"columns":[{"column":"customer_id","nativeType":"bigint","nullable":false,"type":"int64"}],"direction":"referenced-to-owner","references":"Customer"},"from":{"entity":"Customer","label":"Customer"},"id":"relationships:CustomerPlacedOrder","key":[{"column":"id","nativeType":"bigint","nullable":false,"property":"id","type":"int64"}],"kind":"load-relationships","relationship":"CustomerPlacedOrder","relationshipType":"PLACED","table":{"name":"orders","schema":"public"},"to":{"entity":"Order","label":"Order"}},{"dependsOn":["nodes:Order","nodes:OrderItem"],"entity":"OrderItem","foreignKey":{"columns":[{"column":"order_id","nativeType":"bigint","nullable":false,"type":"int64"}],"direction":"referenced-to-owner","references":"Order"},"from":{"entity":"Order","label":"Order"},"id":"relationships:OrderContainsItem","key":[{"column":"order_id","nativeType":"bigint","nullable":false,"property":"orderId","type":"int64"},{"column":"line_no","nativeType":"integer","nullable":false,"property":"lineNo","type":"int64"}],"kind":"load-relationships","relationship":"OrderContainsItem","relationshipType":"CONTAINS","table":{"name":"order_items","schema":"public"},"to":{"entity":"OrderItem","label":"OrderItem"}},{"dependsOn":["nodes:OrderItem","nodes:Product"],"entity":"OrderItem","foreignKey":{"columns":[{"column":"product_id","nativeType":"bigint","nullable":false,"type":"int64"}],"direction":"owner-to-referenced","references":"Product"},"from":{"entity":"OrderItem","label":"OrderItem"},"id":"relationships:ItemOfProduct","key":[{"column":"order_id","nativeType":"bigint","nullable":false,"property":"orderId","type":"int64"},{"column":"line_no","nativeType":"integer","nullable":false,"property":"lineNo","type":"int64"}],"kind":"load-relationships","relationship":"ItemOfProduct","relationshipType":"OF_PRODUCT","table":{"name":"order_items","schema":"public"},"to":{"entity":"Product","label":"Product"}},{"dependsOn":["nodes:Customer"],"entity":"Customer","foreignKey":{"columns":[{"column":"referred_by","nativeType":"bigint","nullable":true,"type":"int64"}],"direction":"owner-to-referenced","references":"Customer"},"from":{"entity":"Customer","label":"Customer"},"id":"relationships:CustomerReferredBy","key":[{"column":"id","nativeType":"bigint","nullable":false,"property":"id","type":"int64"}],"kind":"load-relationships","relationship":"CustomerReferredBy","relationshipType":"REFERRED_BY","selfReference":true,"table":{"name":"customers","schema":"public"},"to":{"entity":"Customer","label":"Customer"}},{"dependsOn":["nodes:Product"],"entity":"Product","foreignKey":{"columns":[{"column":"parent_product_id","nativeType":"bigint","nullable":true,"type":"int64"}],"direction":"owner-to-referenced","references":"Product"},"from":{"entity":"Product","label":"Product"},"id":"relationships:ProductVariantOf","key":[{"column":"id","nativeType":"bigint","nullable":false,"property":"id","type":"int64"}],"kind":"load-relationships","relationship":"ProductVariantOf","relationshipType":"VARIANT_OF","selfReference":true,"table":{"name":"products","schema":"public"},"to":{"entity":"Product","label":"Product"}}],"transformations":[{"allowedBy":"allow-rule","column":"price","entity":"Product","lossKind":"representation","property":"price","reason":"Neo4j has no exact decimal type; prices are stored as canonical decimal strings.","storedAs":"String","type":"decimal"},{"allowedBy":"allow-rule","column":"unit_price","entity":"OrderItem","lossKind":"representation","property":"unitPrice","reason":"Neo4j has no exact decimal type; prices are stored as canonical decimal strings.","storedAs":"String","type":"decimal"}],"warnings":[]}
